[{"id":"184670000000045678","name":"Work","position":1,"group_weight":0.0,"sis_source_id":null,"integration_data":{},"rules":{},"assignments":[{"id":"184670000000123456","description":null,"due_at":"2026-09-19T04:59:59Z","unlock_at":null,"lock_at":null,"points_possible":10.0,"grading_type":"points","assignment_group_id":"184670000000045678","grading_standard_id":null,"created_at":"2026-08-16T19:33:55Z","updated_at":"2026-08-16T19:33:55Z","peer_reviews":false,"automatic_peer_reviews":false,"position":1,"grade_group_students_individually":false,"anonymous_peer_reviews":false,"group_category_id":null,"post_to_sis":false,"moderated_grading":false,"omit_from_final_grade":false,"intra_group_peer_reviews":false,"anonymous_instructor_annotations":false,"anonymous_grading":false,"graders_anonymous_to_graders":false,"grader_count":0,"grader_comments_visible_to_graders":true,"final_grader_id":null,"grader_names_visible_to_final_grader":true,"allowed_attempts":-1,"annotatable_attachment_id":null,"hide_in_gradebook":false,"suppress_assignment":false,"secure_params":"eyJ0eXAiOiJKV1QiLCJhbGciOiJIUzI1NiJ9.eyJsdGlfYXNzaWdubWVudF9pZCI6ImQ0YTk0OTI2LWMyNTMtNDlkMy05MGJlLWM0ZDY4NmI4ZGIwZSIsImx0aV9hc3NpZ25tZW50X2Rlc2NyaXB0aW9uIjoiIn0.0_fQTG6FqjghP_TR6-G5-aXsnlFVNnExd7h9-e4rPzM","lti_context_id":"d4a94926-c253-49d3-90be-c4d686b8db0e","course_id":"184670000000012345","name":"Shard test","submission_types":["online_text_entry"],"has_submitted_submissions":true,"due_date_required":false,"max_name_length":255,"graded_submissions_exist":true,"is_quiz_assignment":false,"can_duplicate":true,"original_course_id":null,"original_assignment_id":null,"original_lti_resource_link_id":null,"original_assignment_name":null,"original_quiz_id":null,"workflow_state":"published","important_dates":false,"muted":false,"html_url":"https://canvas.northfield.example/courses/184670000000012345/assignments/184670000000123456","published":true,"only_visible_to_overrides":false,"visible_to_everyone":true,"submission":{"id":"184670000009876543","body":"\u003cp\u003eShard test response.\u003c/p\u003e","url":null,"grade":"9","score":9.0,"submitted_at":"2026-09-18T23:59:59Z","assignment_id":"184670000000123456","user_id":"4899001","submission_type":"online_text_entry","workflow_state":"graded","grade_matches_current_submission":true,"graded_at":"2026-09-20T14:59:59Z","grader_id":"184670000000300001","attempt":1,"cached_due_date":"2026-09-19T04:59:59Z","excused":false,"late_policy_status":null,"points_deducted":null,"grading_period_id":null,"extra_attempts":null,"posted_at":"2026-09-20T14:59:59Z","redo_request":false,"custom_grade_status_id":null,"sticker":null,"late":false,"missing":false,"seconds_late":0,"entered_grade":"9","entered_score":9.0,"preview_url":"https://canvas.northfield.example/courses/184670000000012345/assignments/184670000000123456/submissions/4899001?preview=1\u0026version=3"},"locked_for_user":false,"submissions_download_url":"https://canvas.northfield.example/courses/184670000000012345/assignments/184670000000123456/submissions?zip=1","post_manually":false,"anonymize_students":false,"new_quizzes_anonymous_participants":false,"require_lockdown_browser":false,"restrict_quantitative_data":false,"in_closed_grading_period":false}],"any_assignment_in_closed_grading_period":false}]