[{"id":"199000","name":"Portfolio","position":1,"group_weight":0.0,"sis_source_id":null,"integration_data":{},"rules":{},"assignments":[{"id":"1290000","description":null,"due_at":null,"unlock_at":null,"lock_at":null,"points_possible":25.0,"grading_type":"points","assignment_group_id":"199000","grading_standard_id":null,"created_at":"2026-08-14T02:24:04Z","updated_at":"2026-08-14T02:24:04Z","peer_reviews":false,"automatic_peer_reviews":false,"position":1,"grade_group_students_individually":false,"anonymous_peer_reviews":false,"group_category_id":null,"post_to_sis":false,"moderated_grading":false,"omit_from_final_grade":false,"intra_group_peer_reviews":false,"anonymous_instructor_annotations":false,"anonymous_grading":false,"graders_anonymous_to_graders":false,"grader_count":0,"grader_comments_visible_to_graders":true,"final_grader_id":null,"grader_names_visible_to_final_grader":true,"allowed_attempts":-1,"annotatable_attachment_id":null,"hide_in_gradebook":false,"suppress_assignment":false,"secure_params":"eyJ0eXAiOiJKV1QiLCJhbGciOiJIUzI1NiJ9.eyJsdGlfYXNzaWdubWVudF9pZCI6ImQ5MzVjYzNlLTJjNWQtNDYwZS1hNjY3LTA1MWEzNzAxNmM2ZiIsImx0aV9hc3NpZ25tZW50X2Rlc2NyaXB0aW9uIjoiIn0.dtHrvVbFXA8CTvBf4VhN4I_jLndLjyru-jcVMqbrwZk","lti_context_id":"d935cc3e-2c5d-460e-a667-051a37016c6f","course_id":"58000","name":"Portfolio Piece 1","submission_types":["online_text_entry"],"has_submitted_submissions":true,"due_date_required":false,"max_name_length":255,"graded_submissions_exist":true,"is_quiz_assignment":false,"can_duplicate":true,"original_course_id":null,"original_assignment_id":null,"original_lti_resource_link_id":null,"original_assignment_name":null,"original_quiz_id":null,"workflow_state":"published","important_dates":false,"muted":false,"html_url":"https://canvas.northfield.example/courses/58000/assignments/1290000","published":true,"only_visible_to_overrides":false,"visible_to_everyone":true,"submission":{"id":"990000000","body":"\u003cp\u003ePortfolio Piece 1 response.\u003c/p\u003e","url":null,"grade":"22","score":22.0,"submitted_at":"2026-09-10T20:59:59Z","assignment_id":"1290000","user_id":"4899001","submission_type":"online_text_entry","workflow_state":"graded","grade_matches_current_submission":true,"graded_at":"2026-09-12T14:59:59Z","grader_id":"301900","attempt":1,"cached_due_date":null,"excused":false,"late_policy_status":null,"points_deducted":null,"grading_period_id":null,"extra_attempts":null,"posted_at":"2026-09-12T14:59:59Z","redo_request":false,"custom_grade_status_id":null,"sticker":null,"late":false,"missing":false,"seconds_late":0,"entered_grade":"22","entered_score":22.0,"preview_url":"https://canvas.northfield.example/courses/58000/assignments/1290000/submissions/4899001?preview=1\u0026version=3"},"locked_for_user":false,"submissions_download_url":"https://canvas.northfield.example/courses/58000/assignments/1290000/submissions?zip=1","post_manually":false,"anonymize_students":false,"new_quizzes_anonymous_participants":false,"require_lockdown_browser":false,"restrict_quantitative_data":false,"in_closed_grading_period":false},{"id":"1290001","description":null,"due_at":null,"unlock_at":null,"lock_at":null,"points_possible":25.0,"grading_type":"points","assignment_group_id":"199000","grading_standard_id":null,"created_at":"2026-08-13T21:39:17Z","updated_at":"2026-08-13T21:39:17Z","peer_reviews":false,"automatic_peer_reviews":false,"position":2,"grade_group_students_individually":false,"anonymous_peer_reviews":false,"group_category_id":null,"post_to_sis":false,"moderated_grading":false,"omit_from_final_grade":false,"intra_group_peer_reviews":false,"anonymous_instructor_annotations":false,"anonymous_grading":false,"graders_anonymous_to_graders":false,"grader_count":0,"grader_comments_visible_to_graders":true,"final_grader_id":null,"grader_names_visible_to_final_grader":true,"allowed_attempts":-1,"annotatable_attachment_id":null,"hide_in_gradebook":false,"suppress_assignment":false,"secure_params":"eyJ0eXAiOiJKV1QiLCJhbGciOiJIUzI1NiJ9.eyJsdGlfYXNzaWdubWVudF9pZCI6IjU4NGI1Y2U0LTkzMmEtNDNmNC05NDEwLTc1YmYzOTE3YjEzNCIsImx0aV9hc3NpZ25tZW50X2Rlc2NyaXB0aW9uIjoiIn0.wyx3jytLaBNUpN3K35lwscqXtOiM-TARNv_wxUpawCM","lti_context_id":"584b5ce4-932a-43f4-9410-75bf3917b134","course_id":"58000","name":"Portfolio Piece 2","submission_types":["online_text_entry"],"has_submitted_submissions":false,"due_date_required":false,"max_name_length":255,"graded_submissions_exist":false,"is_quiz_assignment":false,"can_duplicate":true,"original_course_id":null,"original_assignment_id":null,"original_lti_resource_link_id":null,"original_assignment_name":null,"original_quiz_id":null,"workflow_state":"published","important_dates":false,"muted":false,"html_url":"https://canvas.northfield.example/courses/58000/assignments/1290001","published":true,"only_visible_to_overrides":false,"visible_to_everyone":true,"submission":{"id":"990000079","body":null,"url":null,"grade":null,"score":null,"submitted_at":null,"assignment_id":"1290001","user_id":"4899001","submission_type":null,"workflow_state":"unsubmitted","grade_matches_current_submission":true,"graded_at":null,"grader_id":null,"attempt":null,"cached_due_date":null,"excused":null,"late_policy_status":null,"points_deducted":null,"grading_period_id":null,"extra_attempts":null,"posted_at":null,"redo_request":false,"custom_grade_status_id":null,"sticker":null,"late":false,"missing":false,"seconds_late":0,"entered_grade":null,"entered_score":null,"preview_url":"https://canvas.northfield.example/courses/58000/assignments/1290001/submissions/4899001?preview=1\u0026version=1"},"locked_for_user":false,"submissions_download_url":"https://canvas.northfield.example/courses/58000/assignments/1290001/submissions?zip=1","post_manually":false,"anonymize_students":false,"new_quizzes_anonymous_participants":false,"require_lockdown_browser":false,"restrict_quantitative_data":false,"in_closed_grading_period":false},{"id":"1290002","description":null,"due_at":"2026-10-03T04:59:59Z","unlock_at":null,"lock_at":null,"points_possible":10.0,"grading_type":"points","assignment_group_id":"199000","grading_standard_id":null,"created_at":"2026-08-14T04:17:55Z","updated_at":"2026-08-14T04:17:55Z","peer_reviews":false,"automatic_peer_reviews":false,"position":3,"grade_group_students_individually":false,"anonymous_peer_reviews":false,"group_category_id":null,"post_to_sis":false,"moderated_grading":false,"omit_from_final_grade":false,"intra_group_peer_reviews":false,"anonymous_instructor_annotations":false,"anonymous_grading":false,"graders_anonymous_to_graders":false,"grader_count":0,"grader_comments_visible_to_graders":true,"final_grader_id":null,"grader_names_visible_to_final_grader":true,"allowed_attempts":-1,"annotatable_attachment_id":null,"hide_in_gradebook":false,"suppress_assignment":false,"secure_params":"eyJ0eXAiOiJKV1QiLCJhbGciOiJIUzI1NiJ9.eyJsdGlfYXNzaWdubWVudF9pZCI6ImRjODY4MzAwLTc5YjktNDZjOC1hNjkzLTEzZTkxODMzOTZiYiIsImx0aV9hc3NpZ25tZW50X2Rlc2NyaXB0aW9uIjoiIn0.36SMNh8uUPfF3AT20h8CbSVOP1s0vX0kVIqwChc74zc","lti_context_id":"dc868300-79b9-46c8-a693-13e9183396bb","course_id":"58000","name":"Reflection","submission_types":["online_text_entry"],"has_submitted_submissions":false,"due_date_required":false,"max_name_length":255,"graded_submissions_exist":false,"is_quiz_assignment":false,"can_duplicate":true,"original_course_id":null,"original_assignment_id":null,"original_lti_resource_link_id":null,"original_assignment_name":null,"original_quiz_id":null,"workflow_state":"published","important_dates":false,"muted":false,"html_url":"https://canvas.northfield.example/courses/58000/assignments/1290002","published":true,"only_visible_to_overrides":false,"visible_to_everyone":true,"submission":{"id":"990000082","body":null,"url":null,"grade":null,"score":null,"submitted_at":null,"assignment_id":"1290002","user_id":"4899001","submission_type":null,"workflow_state":"unsubmitted","grade_matches_current_submission":true,"graded_at":null,"grader_id":null,"attempt":null,"cached_due_date":"2026-10-03T04:59:59Z","excused":null,"late_policy_status":null,"points_deducted":null,"grading_period_id":null,"extra_attempts":null,"posted_at":null,"redo_request":false,"custom_grade_status_id":null,"sticker":null,"late":false,"missing":false,"seconds_late":0,"entered_grade":null,"entered_score":null,"preview_url":"https://canvas.northfield.example/courses/58000/assignments/1290002/submissions/4899001?preview=1\u0026version=1"},"locked_for_user":false,"submissions_download_url":"https://canvas.northfield.example/courses/58000/assignments/1290002/submissions?zip=1","post_manually":false,"anonymize_students":false,"new_quizzes_anonymous_participants":false,"require_lockdown_browser":false,"restrict_quantitative_data":false,"in_closed_grading_period":false}],"any_assignment_in_closed_grading_period":false}]