[{"id":"199000","name":"Work","position":1,"group_weight":0.0,"sis_source_id":null,"integration_data":{},"rules":{},"assignments":[{"id":"1290000","description":null,"due_at":"2026-02-10T05:59:59Z","unlock_at":null,"lock_at":null,"points_possible":100.0,"grading_type":"points","assignment_group_id":"199000","grading_standard_id":null,"created_at":"2026-01-05T06:00:00Z","updated_at":"2026-01-05T06:00:00Z","peer_reviews":false,"automatic_peer_reviews":false,"position":1,"grade_group_students_individually":false,"anonymous_peer_reviews":false,"group_category_id":null,"post_to_sis":false,"moderated_grading":false,"omit_from_final_grade":false,"intra_group_peer_reviews":false,"anonymous_instructor_annotations":false,"anonymous_grading":false,"graders_anonymous_to_graders":false,"grader_count":0,"grader_comments_visible_to_graders":true,"final_grader_id":null,"grader_names_visible_to_final_grader":true,"allowed_attempts":-1,"annotatable_attachment_id":null,"hide_in_gradebook":false,"suppress_assignment":false,"secure_params":"eyJ0eXAiOiJKV1QiLCJhbGciOiJIUzI1NiJ9.eyJsdGlfYXNzaWdubWVudF9pZCI6ImE0MjI3YzIxLTNmMTctNDRlZS1hZDFkLTZkNmJmMTMwZjIzNiIsImx0aV9hc3NpZ25tZW50X2Rlc2NyaXB0aW9uIjoiIn0.nixmLL5rPZUaKeLFDDAfbEDPERUsumlXXb1rVbvs2Ng","lti_context_id":"a4227c21-3f17-44ee-ad1d-6d6bf130f236","course_id":"58000","name":"Assignment 1","submission_types":["online_text_entry"],"has_submitted_submissions":true,"due_date_required":false,"max_name_length":255,"graded_submissions_exist":true,"is_quiz_assignment":false,"can_duplicate":true,"original_course_id":null,"original_assignment_id":null,"original_lti_resource_link_id":null,"original_assignment_name":null,"original_quiz_id":null,"workflow_state":"published","important_dates":false,"muted":false,"html_url":"https://canvas.northfield.example/courses/58000/assignments/1290000","published":true,"only_visible_to_overrides":false,"visible_to_everyone":true,"submission":{"id":"990000000","body":"\u003cp\u003eAssignment 1 response.\u003c/p\u003e","url":null,"grade":"88","score":88.0,"submitted_at":"2026-02-10T00:00:00Z","assignment_id":"1290000","user_id":"4899001","submission_type":"online_text_entry","workflow_state":"graded","grade_matches_current_submission":true,"graded_at":"2026-02-11T15:00:00Z","grader_id":"301900","attempt":1,"cached_due_date":"2026-02-10T05:59:59Z","excused":false,"late_policy_status":null,"points_deducted":null,"grading_period_id":null,"extra_attempts":null,"posted_at":"2026-02-11T15:00:00Z","redo_request":false,"custom_grade_status_id":null,"sticker":null,"late":false,"missing":false,"seconds_late":0,"entered_grade":"88","entered_score":88.0,"preview_url":"https://canvas.northfield.example/courses/58000/assignments/1290000/submissions/4899001?preview=1\u0026version=3"},"locked_for_user":false,"submissions_download_url":"https://canvas.northfield.example/courses/58000/assignments/1290000/submissions?zip=1","post_manually":false,"anonymize_students":false,"new_quizzes_anonymous_participants":false,"require_lockdown_browser":false,"restrict_quantitative_data":false,"in_closed_grading_period":false},{"id":"1290001","description":null,"due_at":"2026-02-17T05:59:59Z","unlock_at":null,"lock_at":null,"points_possible":100.0,"grading_type":"points","assignment_group_id":"199000","grading_standard_id":null,"created_at":"2026-01-05T06:00:00Z","updated_at":"2026-01-05T06:00:00Z","peer_reviews":false,"automatic_peer_reviews":false,"position":2,"grade_group_students_individually":false,"anonymous_peer_reviews":false,"group_category_id":null,"post_to_sis":false,"moderated_grading":false,"omit_from_final_grade":false,"intra_group_peer_reviews":false,"anonymous_instructor_annotations":false,"anonymous_grading":false,"graders_anonymous_to_graders":false,"grader_count":0,"grader_comments_visible_to_graders":true,"final_grader_id":null,"grader_names_visible_to_final_grader":true,"allowed_attempts":-1,"annotatable_attachment_id":null,"hide_in_gradebook":false,"suppress_assignment":false,"secure_params":"eyJ0eXAiOiJKV1QiLCJhbGciOiJIUzI1NiJ9.eyJsdGlfYXNzaWdubWVudF9pZCI6IjhhNWI1ZDkyLWUwMmMtNGE3ZC1iYjU1LTRkYzU4YmVkNGU2MCIsImx0aV9hc3NpZ25tZW50X2Rlc2NyaXB0aW9uIjoiIn0.wiu5SjRsyGsg1P0h1KADbw7_XnOrRtECdUYCtPVLXrE","lti_context_id":"8a5b5d92-e02c-4a7d-bb55-4dc58bed4e60","course_id":"58000","name":"Assignment 2","submission_types":["online_text_entry"],"has_submitted_submissions":true,"due_date_required":false,"max_name_length":255,"graded_submissions_exist":true,"is_quiz_assignment":false,"can_duplicate":true,"original_course_id":null,"original_assignment_id":null,"original_lti_resource_link_id":null,"original_assignment_name":null,"original_quiz_id":null,"workflow_state":"published","important_dates":false,"muted":false,"html_url":"https://canvas.northfield.example/courses/58000/assignments/1290001","published":true,"only_visible_to_overrides":false,"visible_to_everyone":true,"submission":{"id":"990000052","body":"\u003cp\u003eAssignment 2 response.\u003c/p\u003e","url":null,"grade":"92","score":92.0,"submitted_at":"2026-02-17T00:00:00Z","assignment_id":"1290001","user_id":"4899001","submission_type":"online_text_entry","workflow_state":"graded","grade_matches_current_submission":true,"graded_at":"2026-02-18T15:00:00Z","grader_id":"301900","attempt":1,"cached_due_date":"2026-02-17T05:59:59Z","excused":false,"late_policy_status":null,"points_deducted":null,"grading_period_id":null,"extra_attempts":null,"posted_at":"2026-02-18T15:00:00Z","redo_request":false,"custom_grade_status_id":null,"sticker":null,"late":false,"missing":false,"seconds_late":0,"entered_grade":"92","entered_score":92.0,"preview_url":"https://canvas.northfield.example/courses/58000/assignments/1290001/submissions/4899001?preview=1\u0026version=3"},"locked_for_user":false,"submissions_download_url":"https://canvas.northfield.example/courses/58000/assignments/1290001/submissions?zip=1","post_manually":false,"anonymize_students":false,"new_quizzes_anonymous_participants":false,"require_lockdown_browser":false,"restrict_quantitative_data":false,"in_closed_grading_period":false},{"id":"1290002","description":null,"due_at":"2026-02-24T05:59:59Z","unlock_at":null,"lock_at":null,"points_possible":100.0,"grading_type":"points","assignment_group_id":"199000","grading_standard_id":null,"created_at":"2026-01-05T06:00:00Z","updated_at":"2026-01-05T06:00:00Z","peer_reviews":false,"automatic_peer_reviews":false,"position":3,"grade_group_students_individually":false,"anonymous_peer_reviews":false,"group_category_id":null,"post_to_sis":false,"moderated_grading":false,"omit_from_final_grade":false,"intra_group_peer_reviews":false,"anonymous_instructor_annotations":false,"anonymous_grading":false,"graders_anonymous_to_graders":false,"grader_count":0,"grader_comments_visible_to_graders":true,"final_grader_id":null,"grader_names_visible_to_final_grader":true,"allowed_attempts":-1,"annotatable_attachment_id":null,"hide_in_gradebook":false,"suppress_assignment":false,"secure_params":"eyJ0eXAiOiJKV1QiLCJhbGciOiJIUzI1NiJ9.eyJsdGlfYXNzaWdubWVudF9pZCI6ImM2NWJmODk1LTgwZWMtNGM4NC04MTY5LWEwNTkwNGNlNzk3MyIsImx0aV9hc3NpZ25tZW50X2Rlc2NyaXB0aW9uIjoiIn0.tR6bLvBqEqfF7yEGY5XfPckJPf-ITulYKC46ixFnJ6Q","lti_context_id":"c65bf895-80ec-4c84-8169-a05904ce7973","course_id":"58000","name":"Assignment 3","submission_types":["online_text_entry"],"has_submitted_submissions":false,"due_date_required":false,"max_name_length":255,"graded_submissions_exist":false,"is_quiz_assignment":false,"can_duplicate":true,"original_course_id":null,"original_assignment_id":null,"original_lti_resource_link_id":null,"original_assignment_name":null,"original_quiz_id":null,"workflow_state":"published","important_dates":false,"muted":false,"html_url":"https://canvas.northfield.example/courses/58000/assignments/1290002","published":true,"only_visible_to_overrides":false,"visible_to_everyone":true,"submission":{"id":"990000073","body":null,"url":null,"grade":null,"score":null,"submitted_at":null,"assignment_id":"1290002","user_id":"4899001","submission_type":null,"workflow_state":"unsubmitted","grade_matches_current_submission":true,"graded_at":null,"grader_id":null,"attempt":null,"cached_due_date":"2026-02-24T05:59:59Z","excused":null,"late_policy_status":null,"points_deducted":null,"grading_period_id":null,"extra_attempts":null,"posted_at":null,"redo_request":false,"custom_grade_status_id":null,"sticker":null,"late":false,"missing":true,"seconds_late":18687601,"entered_grade":null,"entered_score":null,"preview_url":"https://canvas.northfield.example/courses/58000/assignments/1290002/submissions/4899001?preview=1\u0026version=1"},"locked_for_user":false,"submissions_download_url":"https://canvas.northfield.example/courses/58000/assignments/1290002/submissions?zip=1","post_manually":false,"anonymize_students":false,"new_quizzes_anonymous_participants":false,"require_lockdown_browser":false,"restrict_quantitative_data":false,"in_closed_grading_period":false}],"any_assignment_in_closed_grading_period":false}]